{
  "$schema": "https://json-schema.org/draft/2020-12/schema",
  "title": "architecture-docs configuration",
  "type": "object",
  "required": ["schema_version", "docsRoot", "manifest", "viewer", "discovery", "providers"],
  "properties": {
    "schema_version": { "const": 1 },
    "docsRoot": { "type": "string", "minLength": 1 },
    "manifest": { "type": "string", "minLength": 1 },
    "viewer": {
      "type": "object",
      "required": ["template", "output", "readme"],
      "properties": {
        "template": { "type": "string", "minLength": 1 },
        "output": { "type": "string", "minLength": 1 },
        "readme": { "type": "string", "minLength": 1 }
      },
      "additionalProperties": true
    },
    "discovery": {
      "type": "object",
      "required": ["include", "exclude"],
      "properties": {
        "include": { "type": "array", "items": { "type": "string" } },
        "exclude": { "type": "array", "items": { "type": "string" } }
      },
      "additionalProperties": true
    },
    "providers": { "type": "array" },
    "drift": { "type": "object" }
  },
  "additionalProperties": true
}
